{
  "$schema": "http://json-schema.org/draft-07/schema#",
  "$id": "grounded-chunk-v1.schema.json",
  "title": "PO Agent Grounded Chunk Contract (GroundedChunk v1)",
  "description": "Frozen Sprint 28 interface contract (WS-G0, issue #377). Every PO Agent class tool (A corpus / B live-proof / C cost / D ontology) returns GroundedChunk[]; the citation layer renders all four classes identically. Advisory-only, source-grounded, no PHI. See docs/superpowers/specs/2026-07-25-sprint-28-po-agent-contracts.md and docs/adr/0043-product-owner-agent-foundry-iq-domain.md.",
  "type": "object",
  "additionalProperties": false,
  "required": ["classId", "text", "citation", "asOf", "liveness", "status", "confidence", "language"],
  "properties": {
    "classId": {
      "type": "string",
      "enum": ["A", "B", "C", "D"],
      "description": "Knowledge class that produced the chunk: A corpus, B live-proof, C cost, D ontology."
    },
    "text": {
      "type": "string",
      "minLength": 1,
      "description": "The retrieved or computed content."
    },
    "citation": {
      "type": "object",
      "additionalProperties": false,
      "required": ["sourceRef"],
      "properties": {
        "sourceRef": {
          "type": "string",
          "minLength": 1,
          "description": "Mandatory provenance handle: Class A = doc path + commit; Class B = feed + as-of; Class C = cost feed + BVA baseline + as-of; Class D = data-agent artefact ref."
        },
        "anchor": {
          "type": "string",
          "description": "Optional in-source anchor (heading, line, ADR id, cell)."
        },
        "conceptRef": {
          "type": "string",
          "description": "Class D only: ontology concept the answer is grounded on (required for Class D)."
        },
        "goldBinding": {
          "type": "string",
          "description": "Class D only: gold-layer binding backing the concept (required for Class D)."
        }
      }
    },
    "asOf": {
      "type": "string",
      "format": "date-time",
      "description": "ISO-8601 freshness stamp for the chunk."
    },
    "liveness": {
      "type": "string",
      "enum": ["live", "snapshot"],
      "description": "live = resolved from a live source at answer time; snapshot = degraded to a stored value (Class B/C/D on probe failure)."
    },
    "status": {
      "type": "string",
      "enum": ["verified", "partial", "requires-validation"],
      "description": "Grounding status the answer card surfaces as a chip."
    },
    "confidence": {
      "type": "number",
      "minimum": 0.0,
      "maximum": 1.0,
      "description": "Retrieval / reconciliation confidence in [0.0, 1.0]."
    },
    "language": {
      "type": "string",
      "enum": ["de", "en"],
      "description": "Source language of the chunk (DE/EN parity with transparency)."
    }
  },
  "allOf": [
    {
      "if": { "properties": { "classId": { "const": "D" } } },
      "then": {
        "properties": {
          "citation": {
            "required": ["sourceRef", "conceptRef", "goldBinding"]
          }
        }
      }
    }
  ]
}
